{
  "$schema": "./../scaffold-json-schema-v1.json",
  "scaffoldVersion": 1,
  "name": "node-javascript-empty",
  "displayName": "Node.js with JavaScript (Empty)",
  "description": "Minimalistic Node.js JavaScript empty project with lmstudio.js",
  "args": [
    {
      "name": "Project Name",
      "default": "node-javascript-empty",
      "replaceFrom": ["@lmstudio/scaffold-node-javascript-empty", "<PROJECT_NAME>"],
      "isProjectName": true
    }
  ],
  "renames": [{ "from": "gitignore_template", "to": ".gitignore" }],
  "motd": [
    { "type": "title", "text": "âœ“ Project Creation Successful" },
    {
      "type": "regular",
      "text": "An empty Node.js JavaScript project with lmstudio.js has been created in the <hl><PROJECT_NAME></hl> folder. You can enter it with:"
    },
    { "type": "command", "text": "cd <PROJECT_NAME>" },
    { "type": "regular", "text": "Then you can run the project with:" },
    { "type": "command", "text": "lms server start\nnpm start" }
  ]
}
